### ISSUE TITLE
tcpdump

### ISSUE THREAD

**Issue by yangyang5214** [yangyang5214/beer_blog#97]
> tcpdump

就是一些参数的使用，可直接参考 👇 的参考链接，比较详细了

### 无参数

```
ubuntu@VM-0-10-ubuntu:/tmp$ sudo tcpdump
tcpdump: verbose output suppressed, use -v or -vv for full protocol decode
listening on eth0, link-type EN10MB (Ethernet), capture size 262144 bytes
...
```

### -i

```
ubuntu@VM-0-10-ubuntu:/tmp$ sudo tcpdump -i docker0
tcpdump: verbose output suppressed, use -v or -vv for full protocol decode
listening on docker0, link-type EN10MB (Ethernet), capture size 262144 bytes
```

### -c

```
ubuntu@VM-0-10-ubuntu:/tmp$ tcpdump -c --help
tcpdump: invalid packet count --help

# 监听一定数量的包
ubuntu@VM-0-10-ubuntu:/tmp$ sudo tcpdump -c 10
tcpdump: verbose output suppressed, use -v or -vv for full protocol decode
listening on eth0, link-type EN10MB (Ethernet), capture size 262144 bytes
11:47:58.777270 IP VM-0-10-ubuntu.ssh > 180.169.240.110.61662: Flags [P.], seq 1727210368:1727210476, ack 2991309851, win 315, options [nop,nop,TS val 1298375788 ecr 1071491482], length 108
11:47:58.777322 IP VM-0-10-ubuntu.ssh > 180.169.240.110.61662: Flags [P.], seq 108:144, ack 1, win 315, options [nop,nop,TS val 1298375788 ecr 1071491482], length 36
11:47:58.777372 IP VM-0-10-ubuntu.ssh > 180.169.240.110.61662: Flags [P.], seq 144:252, ack 1, win 315, options [nop,nop,TS val 1298375789 ecr 1071491482], length 108
11:47:58.777410 IP VM-0-10-ubuntu.ssh > 180.169.240.110.61662: Flags [P.], seq 252:288, ack 1, win 315, options [nop,nop,TS val 1298375789 ecr 1071491482], length 36
11:47:58.777860 IP VM-0-10-ubuntu.46210 > 183.60.82.98.domain: 13436+ PTR? 110.240.169.180.in-addr.arpa. (46)
11:47:58.836142 IP 180.169.240.110.61662 > VM-0-10-ubuntu.ssh: Flags [.], ack 288, win 2043, options [nop,nop,TS val 1071491546 ecr 1298375789], length 0
11:47:58.843252 IP 183.60.82.98.domain > VM-0-10-ubuntu.46210: 13436 NXDomain 0/1/0 (105)
11:47:58.844405 IP VM-0-10-ubuntu.ssh > 180.169.240.110.61662: Flags [P.], seq 288:1020, ack 1, win 315, options [nop,nop,TS val 1298375856 ecr 1071491546], length 732
11:47:58.844514 IP VM-0-10-ubuntu.56576 > 183.60.82.98.domain: 21196+ PTR? 98.82.60.183.in-addr.arpa. (43)
11:47:58.844902 IP 183.60.82.98.domain > VM-0-10-ubuntu.56576: 21196 NXDomain 0/1/0 (107)
10 packets captured
12 packets received by filter
2 packets dropped by kernel
```

### -D

Use ‘**-D**‘ option to display all the available interfaces for tcpdump command （就很直白。。。）

```
ubuntu@VM-0-10-ubuntu:/tmp$ tcpdump -D
1.eth0 [Up, Running]
2.docker0 [Up, Running]
3.vethe8e2ede [Up, Running]
4.any (Pseudo-device that captures on all interfaces) [Up, Running]
5.lo [Up, Running, Loopback]
6.nflog (Linux netfilter log (NFLOG) interface)
7.nfqueue (Linux netfilter queue (NFQUEUE) interface)
8.usbmon1 (USB bus number 1)
```

### -tttt

human readable timestamp

```
ubuntu@VM-0-10-ubuntu:/tmp$ sudo tcpdump -c 10 -tttt
tcpdump: verbose output suppressed, use -v or -vv for full protocol decode
listening on eth0, link-type EN10MB (Ethernet), capture size 262144 bytes
2021-11-03 11:51:14.749204 IP VM-0-10-ubuntu.ssh > 180.169.240.110.61662: Flags [P.], seq 1727221396:1727221504, ack 2991314207, win 315, options [nop,nop,TS val 1298571760 ecr 1071685008], length 108
2021-11-03 11:51:14.749245 IP VM-0-10-ubuntu.ssh > 180.169.240.110.61662: Flags [P.], seq 108:144, ack 1, win 315, options [nop,nop,TS val 1298571760 ecr 1071685008], length 36
2021-11-03 11:51:14.749281 IP VM-0-10-ubuntu.ssh > 180.169.240.110.61662: Flags [P.], seq 144:252, ack 1, win 315, options [nop,nop,TS val 1298571760 ecr 1071685008], length 108
2021-11-03 11:51:14.749309 IP VM-0-10-ubuntu.ssh > 180.169.240.110.61662: Flags [P.], seq 252:288, ack 1, win 315, options [nop,nop,TS val 1298571760 ecr 1071685008], length 36
2021-11-03 11:51:14.750853 IP VM-0-10-ubuntu.ssh > 180.169.240.110.61662: Flags [P.], seq 288:524, ack 1, win 315, options [nop,nop,TS val 1298571762 ecr 1071685008], length 236
2021-11-03 11:51:14.750891 IP VM-0-10-ubuntu.ssh > 180.169.240.110.61662: Flags [P.], seq 524:560, ack 1, win 315, options [nop,nop,TS val 1298571762 ecr 1071685008], length 36
2021-11-03 11:51:14.750944 IP VM-0-10-ubuntu.ssh > 180.169.240.110.61662: Flags [P.], seq 560:772, ack 1, win 315, options [nop,nop,TS val 1298571762 ecr 1071685008], length 212
2021-11-03 11:51:14.750979 IP VM-0-10-ubuntu.ssh > 180.169.240.110.61662: Flags [P.], seq 772:808, ack 1, win 315, options [nop,nop,TS val 1298571762 ecr 1071685008], length 36
2021-11-03 11:51:14.751020 IP VM-0-10-ubuntu.ssh > 180.169.240.110.61662: Flags [P.], seq 808:1020, ack 1, win 315, options [nop,nop,TS val 1298571762 ecr 1071685008], length 212
2021-11-03 11:51:14.783964 IP 180.169.240.110.61662 > VM-0-10-ubuntu.ssh: Flags [.], ack 0, win 2047, options [nop,nop,TS val 1071685057 ecr 1298571738], length 0
```

### -w/-r

写/读 文件

```
sudo tcpdump -c 10 -tttt  -w 1.pcap
```

### src/dst

```
 sudo tcpdump src 180.169.240.110
 sudo tcpdump dst 180.169.240.110
```

### tcp/udp

```
 sudo tcpdump tcp
 sudo tcpdump udp
```

### -G

copy from 官网文档

```
-G rotate_seconds
    If specified, rotates the dump file specified with the -w option every rotate_seconds seconds. Savefiles will have the name specified by -w which should include a time format as defined by strftime(3). If no time format is specified, each new file will overwrite the previous. Whenever a generated filename is not unique, tcpdump will overwrite the pre-existing data; providing a time specification that is coarser than the capture period is therefore not advised.
    If used in conjunction with the -C option, filenames will take the form of `file<count>'.
```

## 例子

```
# 每分钟的监控流量保存到文件
tcpdump -G 60 -w '%Y-%m-%d %H:%M'.pcap
```

```
# 以 root 用户 监听所有网卡 周期为 10 分钟, 大小为 100M 备份文件
tcpdump -i any -G 600 -C 100M  -w '%Y-%m-%d %H:%M'.pcap -Z root

# 运行例子
total 67M
-rw-r--r--. 1 root root  41M Nov  3 14:52 '2021-11-03 14:42.pcap'
-rw-r--r--. 1 root root  19M Nov  3 15:02 '2021-11-03 14:52.pcap'
-rw-r--r--. 1 root root 5.1M Nov  3 15:05 '2021-11-03 15:02.pcap'
```

## Reference 

https://www.linuxtechi.com/capture-analyze-packets-tcpdump-command-linux/

https://stackoverflow.com/questions/51231858/write-to-another-tcpdump-file-every-minute

https://www.tcpdump.org/manpages/tcpdump.1.html
